{
  "description": "Plain double bars: V18; treated as |.",
  "mvp": true,
  "spec": [
    "§7.5.1",
    "§18"
  ],
  "ast": {
    "cmlVersion": "0.1",
    "metadata": {},
    "sections": [
      {
        "type": null,
        "label": null,
        "core": false,
        "raw": null,
        "elements": [
          {
            "kind": "measure",
            "chords": [
              {
                "kind": "chord",
                "root": "C",
                "accidental": null,
                "quality": null,
                "bass": null,
                "duration": null,
                "noChord": false,
                "raw": "C"
              }
            ]
          },
          {
            "kind": "measure",
            "chords": [
              {
                "kind": "chord",
                "root": "F",
                "accidental": null,
                "quality": null,
                "bass": null,
                "duration": null,
                "noChord": false,
                "raw": "F"
              }
            ]
          },
          {
            "kind": "measure",
            "chords": [
              {
                "kind": "chord",
                "root": "G",
                "accidental": null,
                "quality": null,
                "bass": null,
                "duration": null,
                "noChord": false,
                "raw": "G"
              }
            ]
          },
          {
            "kind": "measure",
            "chords": [
              {
                "kind": "chord",
                "root": "D",
                "accidental": null,
                "quality": null,
                "bass": null,
                "duration": null,
                "noChord": false,
                "raw": "D"
              }
            ]
          }
        ]
      }
    ]
  },
  "diagnostics": [
    {
      "code": "V18",
      "severity": "warning",
      "line": 1,
      "column": 1
    },
    {
      "code": "V18",
      "severity": "warning",
      "line": 1,
      "column": 10
    },
    {
      "code": "V18",
      "severity": "warning",
      "line": 2,
      "column": 5
    }
  ]
}
