{
  "description": "Measures with no section header form one implicit section.",
  "mvp": true,
  "spec": [
    "§6.4",
    "§7.1"
  ],
  "ast": {
    "cmlVersion": "0.1",
    "metadata": {},
    "sections": [
      {
        "type": null,
        "label": null,
        "core": false,
        "raw": null,
        "elements": [
          {
            "kind": "measure",
            "chords": [
              {
                "kind": "chord",
                "root": "C",
                "accidental": null,
                "quality": null,
                "bass": null,
                "duration": null,
                "noChord": false,
                "raw": "C"
              }
            ]
          },
          {
            "kind": "measure",
            "chords": [
              {
                "kind": "chord",
                "root": "F",
                "accidental": null,
                "quality": null,
                "bass": null,
                "duration": null,
                "noChord": false,
                "raw": "F"
              }
            ]
          },
          {
            "kind": "measure",
            "chords": [
              {
                "kind": "chord",
                "root": "G",
                "accidental": null,
                "quality": null,
                "bass": null,
                "duration": null,
                "noChord": false,
                "raw": "G"
              }
            ]
          },
          {
            "kind": "measure",
            "chords": [
              {
                "kind": "chord",
                "root": "C",
                "accidental": null,
                "quality": null,
                "bass": null,
                "duration": null,
                "noChord": false,
                "raw": "C"
              }
            ]
          }
        ]
      }
    ]
  },
  "diagnostics": []
}
