{
  "description": "A ||: while a repeat is open: V9; the inner marker is treated as |.",
  "mvp": true,
  "spec": [
    "§9.3",
    "§18"
  ],
  "ast": {
    "cmlVersion": "0.1",
    "metadata": {},
    "sections": [
      {
        "type": null,
        "label": null,
        "core": false,
        "raw": null,
        "elements": [
          {
            "kind": "repeat",
            "count": 2,
            "body": [
              {
                "kind": "measure",
                "chords": [
                  {
                    "kind": "chord",
                    "root": "C",
                    "accidental": null,
                    "quality": null,
                    "bass": null,
                    "duration": null,
                    "noChord": false,
                    "raw": "C"
                  }
                ]
              },
              {
                "kind": "measure",
                "chords": [
                  {
                    "kind": "chord",
                    "root": "F",
                    "accidental": null,
                    "quality": null,
                    "bass": null,
                    "duration": null,
                    "noChord": false,
                    "raw": "F"
                  }
                ]
              },
              {
                "kind": "measure",
                "chords": [
                  {
                    "kind": "chord",
                    "root": "G",
                    "accidental": null,
                    "quality": null,
                    "bass": null,
                    "duration": null,
                    "noChord": false,
                    "raw": "G"
                  }
                ]
              }
            ],
            "endings": []
          }
        ]
      }
    ]
  },
  "diagnostics": [
    {
      "code": "V9",
      "severity": "error",
      "line": 2,
      "column": 1
    }
  ]
}
