{
  "description": "CRLF line endings and no newline at end of file.",
  "mvp": true,
  "spec": [
    "§4"
  ],
  "ast": {
    "cmlVersion": "0.1",
    "metadata": {
      "title": "CRLF"
    },
    "sections": [
      {
        "type": "Verse",
        "label": null,
        "core": true,
        "raw": "Verse",
        "elements": [
          {
            "kind": "measure",
            "chords": [
              {
                "kind": "chord",
                "root": "C",
                "accidental": null,
                "quality": null,
                "bass": null,
                "duration": null,
                "noChord": false,
                "raw": "C"
              }
            ]
          },
          {
            "kind": "measure",
            "chords": [
              {
                "kind": "chord",
                "root": "G",
                "accidental": null,
                "quality": null,
                "bass": null,
                "duration": null,
                "noChord": false,
                "raw": "G"
              }
            ]
          }
        ]
      }
    ]
  },
  "diagnostics": []
}
